{
  "contract": "can.signal-hypothesis-pack",
  "contract_version": "1.0.0",
  "pack_id": "toyota.4runner.2005.passive-can-hypotheses",
  "pack_version": "0.1.0",
  "target": {
    "make": "Toyota",
    "model": "4Runner",
    "model_year": 2005,
    "engine": null,
    "drivetrain": null,
    "vin_resolved": false
  },
  "authority": {
    "status": "DISCOVERY_ONLY",
    "accepted_signal_definitions": 0,
    "production_value_display_allowed": false,
    "automatic_promotion_allowed": false,
    "statement": "These are cross-model research hypotheses evaluated against target-vehicle raw evidence. They are not accepted signal definitions and may appear only on an engineering research surface with an unverified badge."
  },
  "sources": [
    {
      "source_id": "csu-toyota-can-2010-camry",
      "authority_level": "B",
      "publisher": "Colorado State University",
      "url": "https://www.engr.colostate.edu/~jdaily/tucrrc/ToyotaCAN.html",
      "revision": null,
      "scope": "Independent physical-measurement correlation of an 11-bit, 500 kbit/s CAN network on a 2010 Toyota Camry.",
      "limitations": "The vehicle, ECUs, calibration, options, and model year differ from the target 2005 4Runner. Its identifiers and fields are discovery clues only."
    },
    {
      "source_id": "realdash-fj-cruiser-cedfdf49",
      "authority_level": "C",
      "publisher": "RealDash-extras contributor M. Main",
      "url": "https://github.com/janimm/RealDash-extras/blob/cedfdf491b53d331625930909f949b657441f4a3/RealDash-CAN/XML-files/toyota/toyota_fj_can.xml",
      "revision": "cedfdf491b53d331625930909f949b657441f4a3",
      "scope": "Community mapping labeled for a 2012 Toyota FJ Cruiser, a useful related-platform source for field and scaling hypotheses.",
      "limitations": "Community artifact, later model year, and no exact 2005 4Runner applicability proof. It cannot establish a production decode by itself."
    },
    {
      "source_id": "comma-opendbc-b4ef5e1",
      "authority_level": "B",
      "publisher": "comma.ai opendbc",
      "url": "https://github.com/commaai/opendbc/tree/b4ef5e1cf406ff143fa67bdbfb154739d43279c9/opendbc/dbc",
      "revision": "b4ef5e1cf406ff143fa67bdbfb154739d43279c9",
      "scope": "Version-pinned Toyota DBC source showing the recurring 0x025 signed 12-bit steering field across several Toyota platforms and Toyota engine-speed scaling on other message generations.",
      "limitations": "No exact 2005 4Runner DBC is present. Cross-model field recurrence does not prove target scaling, sign, source ECU, or applicability."
    },
    {
      "source_id": "aim-community-dbc-6e2f88f",
      "authority_level": "C",
      "publisher": "CAN-DBC-Collection",
      "url": "https://github.com/billyjack2/CAN-DBC-Collection/blob/6e2f88fd6cd9c1f47d0db7bd022711b106f27027/TOYOTA/LEXUS/can1v3.dbc",
      "revision": "6e2f88fd6cd9c1f47d0db7bd022711b106f27027",
      "scope": "Community transcription labeled as an AiM Toyota/Lexus protocol, including 0x025, 0x224, 0x2C1, and 0x2C4 candidates.",
      "limitations": "No exact target applicability proof and no repository license was established for importing its definitions as accepted project data."
    }
  ],
  "hypotheses": [
    {
      "hypothesis_id": "toyota.2c4.engine-speed.be16",
      "identifier": 708,
      "identifier_hex": "0x2C4",
      "extended": false,
      "candidate_semantic": "engine.speed",
      "status": "HIGH_PRIORITY_CROSS_MODEL_CANDIDATE",
      "field": {
        "byte_offset": 0,
        "byte_length": 2,
        "endianness": "BIG",
        "mask": 65535,
        "right_shift": 0,
        "signed_bits": null
      },
      "candidate_transforms": [
        {
          "transform_id": "toyota-rpm-x0p78125",
          "scale": 0.78125,
          "offset": 0,
          "unit": "rpm",
          "source_ids": [
            "realdash-fj-cruiser-cedfdf49",
            "aim-community-dbc-6e2f88f"
          ],
          "note": "Both pinned cross-model artifacts independently use raw times 0.78125 for this identifier."
        }
      ],
      "source_ids": [
        "csu-toyota-can-2010-camry",
        "realdash-fj-cruiser-cedfdf49",
        "aim-community-dbc-6e2f88f"
      ],
      "production_value_display_allowed": false,
      "required_validation": [
        "Capture SAE J1979 PID 0x0C or Toyota Techstream engine speed on the same gateway monotonic timeline.",
        "Verify scale, zero behavior, cadence, missing/stale handling, and repeatability across engine-off, idle, and separated throttle segments.",
        "Resolve the target VIN, engine, drivetrain, and emissions configuration before promotion."
      ],
      "limitations": "The identifier and byte field recur in Toyota research, but no authoritative exact-vehicle source has established the 2005 4Runner scaling."
    },
    {
      "hypothesis_id": "toyota.2c4.intake-air-temperature.byte3",
      "identifier": 708,
      "identifier_hex": "0x2C4",
      "extended": false,
      "candidate_semantic": "engine.intake-air-temperature",
      "status": "CROSS_MODEL_CANDIDATE",
      "field": {
        "byte_offset": 3,
        "byte_length": 1,
        "endianness": "BIG",
        "mask": 255,
        "right_shift": 0,
        "signed_bits": null
      },
      "candidate_transforms": [
        {
          "transform_id": "fj-intake-air-temperature-raw-degc",
          "scale": 1,
          "offset": 0,
          "unit": "degC",
          "source_ids": ["realdash-fj-cruiser-cedfdf49"],
          "note": "The related-platform file labels byte 3 as intake-air temperature with no offset."
        }
      ],
      "source_ids": ["realdash-fj-cruiser-cedfdf49"],
      "production_value_display_allowed": false,
      "required_validation": [
        "Compare against SAE J1979 PID 0x0F or Toyota Techstream intake-air temperature during cold soak and warm operation.",
        "Verify whether an offset is required and reject the hypothesis if the raw field does not track the independent reference."
      ],
      "limitations": "Only one related-platform community source supplies this byte mapping, so the apparently plausible target range is not semantic proof."
    },
    {
      "hypothesis_id": "toyota.2d0.turbine-speed.be16",
      "identifier": 720,
      "identifier_hex": "0x2D0",
      "extended": false,
      "candidate_semantic": "transmission.turbine-speed",
      "status": "CROSS_MODEL_CANDIDATE",
      "field": {
        "byte_offset": 0,
        "byte_length": 2,
        "endianness": "BIG",
        "mask": 65535,
        "right_shift": 0,
        "signed_bits": null
      },
      "candidate_transforms": [
        {
          "transform_id": "fj-turbine-rpm-x0p390625",
          "scale": 0.390625,
          "offset": 0,
          "unit": "rpm",
          "source_ids": ["realdash-fj-cruiser-cedfdf49"],
          "note": "The related-platform file labels the first word turbine RPM and divides raw by 2.56."
        }
      ],
      "source_ids": [
        "csu-toyota-can-2010-camry",
        "realdash-fj-cruiser-cedfdf49"
      ],
      "production_value_display_allowed": false,
      "required_validation": [
        "Compare the candidate against Techstream turbine/input speed, engine speed, vehicle speed, selected gear, and converter lockup across park, launch, shifts, coast, and stop.",
        "Require the engine/turbine relationship to change consistently with known driveline states before assigning the semantic."
      ],
      "limitations": "CSU left this identifier unknown on a 2010 Camry; the turbine interpretation and scale come from one later related-platform community mapping."
    },
    {
      "hypothesis_id": "toyota.2d0.selector-code.byte2",
      "identifier": 720,
      "identifier_hex": "0x2D0",
      "extended": false,
      "candidate_semantic": "transmission.selector-code",
      "status": "CROSS_MODEL_CANDIDATE",
      "field": {
        "byte_offset": 2,
        "byte_length": 1,
        "endianness": "BIG",
        "mask": 127,
        "right_shift": 0,
        "signed_bits": null
      },
      "candidate_transforms": [
        {
          "transform_id": "fj-selector-enum-code",
          "scale": 1,
          "offset": 0,
          "unit": "enum_code",
          "source_ids": ["realdash-fj-cruiser-cedfdf49"],
          "note": "The related-platform source assigns selector states to this masked byte; target enum meanings remain unverified."
        }
      ],
      "source_ids": ["realdash-fj-cruiser-cedfdf49"],
      "production_value_display_allowed": false,
      "required_validation": [
        "Record explicit P, R, N, D, and manual-selector markers while stationary with the brake applied.",
        "Require stable, repeatable one-to-one codes before assigning selector labels."
      ],
      "limitations": "The target capture contains only a small unlabeled code set and cannot establish which state any code represents."
    },
    {
      "hypothesis_id": "toyota.2c1.accelerator-pedal.byte6",
      "identifier": 705,
      "identifier_hex": "0x2C1",
      "extended": false,
      "candidate_semantic": "engine.accelerator-pedal-position",
      "status": "HIGH_PRIORITY_CROSS_MODEL_CANDIDATE",
      "field": {
        "byte_offset": 6,
        "byte_length": 1,
        "endianness": "BIG",
        "mask": 255,
        "right_shift": 0,
        "signed_bits": null
      },
      "candidate_transforms": [
        {
          "transform_id": "fj-pedal-x0p5-percent",
          "scale": 0.5,
          "offset": 0,
          "unit": "percent",
          "source_ids": ["realdash-fj-cruiser-cedfdf49"],
          "note": "CSU independently identifies one-indexed byte 7 as throttle-pedal behavior; the related-platform file supplies the 0.5 percent-per-count hypothesis."
        }
      ],
      "source_ids": [
        "csu-toyota-can-2010-camry",
        "realdash-fj-cruiser-cedfdf49",
        "aim-community-dbc-6e2f88f"
      ],